	project_name	project_by	location	status	project_desciption	possesion_date	area	unit_type	Super_builduparea	Builder_price	Apartment	total_unit	rera_id
0	Corporate Arcadia	Corporate Leisure	Carmelaram	Under Construction	Arcadia is enchantingly designed around peace, amidst the pristine and serene ambience of chikkabellandur, 5 minutes drive from the Wipro corporate office and 10mins drive from Cisco Campus on Outer Ring Road. Arcadia is spread over 5 acres of land with 75% of the available space retained for beautifully designed landscaped areas and amenities. The entire project comprises of 2 Blocks - Block-1 & Block 2, having 3 and 5 wings respectively. A total of 360 flats are aesthetically designed among these Wings.”	Possession date: Apr'19	1404 sq ft(3BHK+2T)	3 BHK	835 - 1,404 sq ft	₹ 35.07 L - ₹ 58.97 L	1, 2, 3 BHK	360	
1	CMRS Rishi Enclave	CMRS	Brookefield	On Hold	CMRS Rishi Enclave is a residential complex in Brookefield, Bangalore. The community has 2 and 3BHK flats on offer whose construction shall begin soon. A total of 74 units have been put up for sale, at prices which range from Rs 42.8 to 57.2 lakhs. The sizes of the apartments vary between 1070 and 1429 sq. ft. The community covers an area of 1 acre, which also comprises of amenities such as swimming pool, gymnasium, cafeteria, club house, intercom services and rainwater harvesting. The CMRS Group has worked on twenty five projects so far, seventeen of which are under construction. Some of these projects are located in Kalyan Nagar and Marathahalli.Brookefield is located close to areas such as Vijayangar, Kannamangala, Segehalli and Belathur. It is bounded by roads such as Old Airport Road and Outer Ring Road. The area is only 11 minutes away from the ITPL and 9 minutes from Whitefield. BMTC buses ply through here to connect it to different parts of the city. The area has several shopping malls (Forum Value Mall), schools (Ryan International School) and hospitals in the vicinity.	Possession date: Apr'18	1429 sq ft(3BHK+3T)	3 BHK	1,070 - 1,429 sq ft	₹ 42.80 L - ₹ 57.16 L	2, 3 BHK	74	
2	SNR Luxuria	SNR Square	Bilekahalli	Pre Launch	SNR Square Luxuria group has launched a premium project in the Bilekahalli region of Bengaluru. The entire project is all set for moving in purpose. The required necessities like park, petrol pump, school, ATM, bank, hospital etc. in the neighbourhood. The amenities provided by this project is a playground for the kids, security for 24 hours and a beautiful landscaped garden, a power backup system for 24 hours and much more. The price of the apartments depends on the request value.Updated with Total Supply-28, Launch Units-28, Availability-13, Price-4500/sqft(Builtup Price), Sales of June'17 are updated with 1 unit.	Possession date: Dec'18	1530 sq ft(3BHK+3T)	3 BHK	1,115 - 1,530 sq ft	₹ 50.17 L - ₹ 68.85 L	2, 3 BHK	28	
3	Ahad Excellencia	Ahad Builders	Avalahalli Off Sarjapur Road	Under Construction		Possession date: Aug'20	1444 sq ft(3BHK+3T)	3 BHK	475 - 1,444 sq ft	₹ 26.17 L - ₹ 75.20 L	1, 2, 3 BHK	505	
4	DS Silver Wood	DS Max Properties	Bommasandra	Under Construction	DS Max Silver Wood is an under construction housing project in Bommasandra, Bangalore. It has apartments of 2 and 3 BHK configuration available through the developer.Spread over 1.15 acre, the community has various facilities on offer alongside the apartments. Some of the conveniences are swimming pool, gymnasium, jogging track, childrens play zone and intercom connectivity. DS Max Properties is one of Bangalores leading property developers which have worked on ninety six properties so far. Forty four projects of theirs are under construction. Electronics City is an IT hub of Bangalore which is towards the south of the city.	Possession date: Sep'18	1745 sq ft(3BHK+2T)	3 BHK	965 - 1,745 sq ft	₹ 24.13 L - ₹ 43.63 L	2, 3 BHK	116	
5	AMP Absolute	AMP	Avalahalli Off Sarjapur Road	On Hold		Possession date: Apr'18	1657 sq ft(3BHK+3T)	3 BHK	1,102 - 1,657 sq ft	₹ 33.61 L - ₹ 50.54 L	2, 3 BHK	60	
6	Aratt Cityscape Apartment	Aratt	Budigere Cross	Under Construction	Cityscape Apartment is a premium housing project launched by Aratt in Budigere Cross, Bangalore. These 2, 3 BHK Apartment in Old Madras Road are available from 1307 sqft to 1508 sqft. Among the many luxurious amenities that the project hosts are Landscaped Gardens, Lift Available, Vaastu Compliant, Football Court, Tennis Court, Swimming Pool etc. Starting at @Rs 3,600 per sqft, Apartment are available at attractive price points. The Apartment will be available for sale from Rs 47.05 lacs to Rs 54.29 lacs.	Possession date: Dec'18	1536 sq ft(3BHK+3T)	3 BHK	1,307 - 1,536 sq ft	₹ 44.44 L - ₹ 52.22 L	2, 3 BHK	152	
7	Nitesh Virgin Island	Nitesh Estates	Budigere Cross	On Hold	Nitesh Virgin Island is a housing community located in Budigere Cross, Bangalore. Sprawling over an area of 8.15 acres, the community has numerous amenities on offer apart from the residential towers. Some of the amenities offered within include swimming pool, club house, gymnasium, landscaped gardens, kids’ play area, rainwater harvesting and round the clock security. The Nitesh Group was launched in 2004 and within a decade of existence, they have worked on thirty projects. Fifteen of their properties are under construction currently. Apart from Budigere Cross, they have worked on projects in Talaghattapura and Hulimavu.	Possession date: Jun'19	3453 sq ft(4BHK+6T + Servant Room)	4 BHK	460 - 3,453 sq ft	₹ 20.01 L - ₹ 1.50 Cr	1, 2, 3, 4 BHK	723	
8	Bren Starlight	Bren	Budigere Cross	Under Construction	"Bren Starlight Bangalore offers premium 1 BHK, 2 BHK and 3 BHK apartments to buyers.Key amenities on offer at this project include car parking facilities, rainwater harvesting systems, gymnasium, intercom facilities, swimming pool, club house, indoor game facilities, playing zone for children, power backup facilities, 24 hour security services, maintenance services, climbing wall, basketball court, library, community hall, security cabin, tennis court and health facilities.Added amenities include broadband internet connectivity, visitors’ parking, cricket pitch, water features, badminton court, pavilion with barbeque and a skating rink. Located at Budigere Cross, Bangalore.
"	Possession date: Sep'19	1530 sq ft(3BHK+3T)	3 BHK	915 - 1,530 sq ft	₹ 43.92 L - ₹ 73.44 L	1, 2, 3 BHK	194	RERA ID: PR/KN/170729/000368
9	Ksr Basil Apartments	Ksr Properties	Budigere Cross	Under Construction	Basil Apartments is a premium project offering spacious 1, 2 and 3BHK apartments located in Budigere Cross, Bangalore. A total of 344 apartments are available for sale which measure in between 607 to 1667 sq ft. The total area covered by the community is 5.5 acres and comprises of several amenities apart from residential towers. Some of the amenities include Swimming pool, Children's play area, Jogging Track, Party Hall, Indoor Games and Doctors Clinic. Established 16 years ago, KSR Group is one of the highly respected realtors in Bangalore. They have worked on 6 projects so far. Out of which, 3 are under construction. Apart from Basil Apartments, their projects are based in Madhurawada, Budigere Cross, Thanisandra and Hebbal. Budigere Cross is one of the most comfortable areas in Bangalore. It is surrounded by developed areas such as Chikballapur, Jalahalli, Vasanth Nagar, Brookefield and Bommasandra.	Possession date: Dec'18	1667 sq ft(3BHK+3T)	3 BHK	607 - 1,667 sq ft	₹ 21.85 L - ₹ 60.01 L	1, 2, 3 BHK	260	
10	Salarpuria East Crest	Salarpuria Sattva Group	Budigere Cross	Under Construction	East Crest is a residential project by Salarpuria Sattva Group located in the Budigere Cross locality of Bangalore. Spread over an area of 6.6 acres, the project offers 1, 2 and 3 BHK apartments with their carpet area ranging from 598 sq ft to 1,673 sq ft. Ceramic tiles dado on kitchen walls, modular switches and Vitrified Tiles flooring in the master bedroom are some of the key highlights of the project. It is currently in an under construction stage. The possession of the project is scheduled in March 2019.The project hosts plenty of amenities which include but not limited to a swimming pool, children's play area, club house, power backup provision, round-the-clock security provision, cricket pitch, indoor games facility and intercom facility.Budigere Cross is located towards the east side of Bangalore. The area is surrounded by other developed localities such as Hostoke, Horamavu, Chikkagubbi, Kuvempu and ITPL. The Whitefield and Marathahalli are respectively 7 and 11 kilometers from here. The vicinity also comprises of various schools, colleges, hotels, parks, banks and shopping centers.	Possession date: Mar'19	1673 sq ft(3BHK+3T)	3 BHK	598 - 1,673 sq ft	₹ 57.73 L - ₹ 81.44 L	1, 2, 3 BHK	667	RERA ID: PR/KN/170730/000406
11	Shriram Green Field	Shriram Properties	Budigere Cross	Under Construction	Green Field project is registered in RERA with following RERA IDs 1.PR/KN/170810/001220 SHRIRAM GREEN FIELD PHASE 2 & PR/KN/170808/001213 SHRIRAM GREEN FIELD PHASE 1. Greenfield is a residential project spread over an area of 20 acres. Located in the Budigere Cross locality of Bangalore, it is a project by Shriram Properties. It offers 2 and 3 BHK apartments with their carpet area ranging from 928 sq ft to 1,350 sq ft. Laminated wooden flooring in the master bedroom, texture paint on the outside of the apartment, sal wood frame for the internal door are some of the specifications of the apartment. Currently, the project is in an under construction stage. Its possession is due in March 2019.When it comes to amenities, Greenfield offers a clubhouse, gymnasium, swimming pool, play area for children, library, spa, Wi-Fi connectivity, party hall and much more.The Budigere Cross locality is situated toward the east of Bangalore. Hoskote, Horamavu, Chikkagubbi, Anagalapura, Ramamurthy Nagar, Kuvempu, are some of the developed areas that surround this locality. The airport is 35 kilometres from here, and the Old Madras road connects it to the nearest railway station. Several schools, hospitals and shopping zones are located in and around the area.	Possession date: Mar'19	1350 sq ft(3BHK+3T)	3 BHK	928 - 1,350 sq ft	₹ 36.37 L - ₹ 54.40 L	2, 3 BHK	932	RERA ID: PR/KN/170810/001220
12	Ardente Pine Grove	Ardente	Avalahalli Off Sarjapur Road	Under Construction	Pinegrove by Ardente, located in Avanahalli, Bangalore, offers 3BHK apartments. This real estate project hosts various amenities such as gymnasium, swimming pool, childrens play area, club house, intercom, jogging track, power backup, landscaped gardens, indoor games, multipurpose hall, and car parking tennis court, fitness court and so on.Located in the western part of Bangalore, Avanahalli is surrounded by Ganapathi Nagar, New BDA Layout, Srinagar, Telecom Colony, etc. It has emerged as one of the most preferred destinations for residential purposes due to its proximity to all amenities and the tranquil atmosphere. The Mysore Road, Outer Ring Road, and the NICE Bangalore Mysore Expressway are all located near this area which ensures smooth connectivity.	Possession date: Dec'19	2025 sq ft(3BHK+3T)	3 BHK	1,639 - 2,025 sq ft	₹ 70.48 L - ₹ 87.08 L	3 BHK	119	
13	MJ Amaze	MJ	Avalahalli Off Sarjapur Road	On Hold		Possession date: Oct'18	1434 sq ft(3BHK+3T)	3 BHK	900 - 1,434 sq ft	₹ 22.50 L - ₹ 35.85 L	2, 3 BHK	232	
14	S AND S Builders Trillium Apartments	S AND S Builders	Avalahalli Off Sarjapur Road	Under Construction	S and S Builders & Developers Apartments Bangalore comes with premium 2 BHK and 3 BHK apartments. Key amenities on offer at this project include a well equipped gymnasium, club house, swimming pool, intercom facilities, playing zone for kids, multipurpose room and 24 hour security services.Added amenities include a jogging track, walkway and car parking facilities. Located at Avalahalli, the project is well connected to areas like the New BDA Layout, Girinagar, Ganapathi Nagar and Srinagar. The Outer Ring Road, Mysore Road and NICE Mysore-Bangalore Expressway connect the project to several destinations in the city with aplomb.	Possession date: Dec'18	1500 sq ft(3BHK+2T)	3 BHK	955 - 1,500 sq ft	₹ 31.04 L - ₹ 48.75 L	2, 3 BHK	137	
15	Prabhavathi Daffodils	Prabhavathi	Avalahalli Off Sarjapur Road	On Hold	For those who want to live in their dream Prabhavathi Daffodils caters the highest standards and stands out for its fine design with sophisticated interiors, the international standard of living can be experienced here with the list of high end amenities. Offering 1/2/3 BHK apartments off Sarjapur road in Bangalore, a well know location for its residential ambience.Prabhavathi Daffodils, the symbol of style, luxury and comfort. The property is located near Amrita College of Engineering, Off Sarjapur Road, Kasavanahalli, Bangalore.	Possession date: Jun'18	1660 sq ft(3BHK+3T)	3 BHK	517 - 1,660 sq ft	₹ 18.09 L - ₹ 58.10 L	1, 2, 3 BHK	500	
16	TG Ascent	TG	Avalahalli Off Sarjapur Road	Launch	Avalahalli Off Sarjapur Road region of Bengaluru is one of the most popular areas which are now getting reorganized by the real estate projects. One of them is the T G Developers Ascent project which is under construction. The cost depends on request. The region where this project is available is surrounded by restaurants, bus stations, ATMs, banks, train stations, parks, schools, petrol pumps, hospitals and schools. The area is also accessible via major roads. The different facilities of the project are playground for children, and security services.	Possession date: Jul'19	1320 sq ft(3BHK+3T)	3 BHK	1,050 - 1,320 sq ft	₹ 39.90 L - ₹ 50.16 L	2, 3 BHK	312	
17	Garudachala Green Field	Garudachala Estates	Doddanekundi	On Hold	Doddanekundi region of Bangalore is an interior area which is getting developed by the real estate projects and properties. One of them is the Garudachala Estates Garuda Green Field Residency project which has available apartments of 2 and 3 BHK only. The entire project has many facilities near its premises like restaurant, bus station, ATM, bank, train station, park, school, petrol pump, hospital, higher education schools and also a play school facility. The area is also accessible via major high roads. Other amenities like gym, swimming pool, club house, and playground for children, intercom services and much more are also available.	Possession started from: Dec'17	1800 sq ft(3BHK+3T)	3 BHK	1,100 - 1,800 sq ft	₹ 60.50 L - ₹ 99.00 L	2, 3 BHK	90	
18	Mana Tropicale	Mana Projects	Avalahalli Off Sarjapur Road	Under Construction	A premium housing project launched by Mana, Tropicale in Avalahalli Off Sarjapur Road, Bangalore is offering Apartment starting at Rs 43.84 lacs. It offers 2, 3 BHK Apartment in Bangalore East. The project is Under Construction project and possession in Dec 18. Among the many luxurious amenities that the project boasts are Cricket Net, Hammocks Zone, Badminton Court, Shopping Mall, Gymnasium etc. The Apartment are available from 1050 sqft to 1789 sqft at an attractive price points starting at @Rs 4,175 per sqft.	Possession date: Jun'19	2461 sq ft(3BHK+3T)	3 BHK	1,050 - 2,461 sq ft	₹ 47.25 L - ₹ 1.11 Cr	2, 3 BHK	240	
19	Bhoomika Sampurna	Bhoomika	Bidadi	On Hold	BhoomikaSampoorna Company is developing apartments in the Bidadi region of Bangalore which is set for moving in purpose. They have a range of modern style residential apartments. The area of the apartments is efficiently planned making the most use of available space. This project has all the required amenities like, security surveillance for 24 hours, beautiful landscaped garden, individual parking area for each apartment and rain water harvesting system, and much more. The locality is well settled with all kinds of facilities available within a mile like hospital, banking, ATM, petrol pump, and bus station, school etc. The cost of the apartments and further details can be availed on request.	Possession started from: Feb'18	1069 sq ft(3BHK+3T)	3 BHK	937 - 1,069 sq ft	₹ 29.97 L - ₹ 34.20 L	2, 3 BHK	348	
20	Riteway Pristina Apartments	Riteway Projects	Bidadi	On Hold	Riteway Projects Pristina Apartments Bangalore offers 1, 2 and 3 BHK homes for buyers, and comes with several amenities and facilities. These include a swimming pool, power backup, clubhouse, playing zone for kids, jogging track, car parking facilities, badminton court, basketball court, theme parks, underground electrical cabling, LED street lighting, spacious and wide tar roads, open air theatre and eco-friendly sewage treatment plant. Located off the Mysore-Bangalore Expressway at Bidadi, the project is well connected to places like Channapatna, Magadi and Kanakapura. The area is also home to a reliable BMTC bus transport network while the Bidadi railway station is also well linked to the project.	Possession started from: Dec'17	1400 sq ft(3BHK+3T)	3 BHK	750 - 1,400 sq ft	₹ 22.50 L - ₹ 42.00 L	1, 2, 3 BHK	100	
21	Sampurna Ocean	Sampurna Bhoomika Infra India Pvt Ltd	Bidadi	On Hold	We are happy to announce that SBIPL is coming up with a Big residential project Ocean with star class amenities near Bidadi, which is very close to the Industrial Area and Innovative Film City, with a very good approach and connectivity situated on 150 Ft Double Road. The entire project is spread on a land area of 5 Acres. The entire project is unique in its own way where there are no common walls with independent House Concept, with 100% Vaastu Complaisant, Eco-Friendly with Good Ventilation and gives 360 View. SBIPL has taken maximum care in designing these apartments which has resulted in a choice of only East or North facing units to our esteemed customers.	Possession started from: Feb'18	1185 sq ft(3BHK+2T)	3 BHK	900 - 1,185 sq ft	₹ 27.00 L - ₹ 35.55 L	2, 3 BHK	600	
22	Vijayas Vaibhav	Vijayas Ventures	Bommasandra	Under Construction	Bommasandra region of Bangalore is one of the popular areas due to the vast projects of real estate that are taking place in this region. Vijayas Ventures Vaibhav Residency Company is developing a residential estate which will deliver spacious apartments. The entire project is still in under construction phase. The different amenities provided by these project area children play ground area for everybody for playing the sport, intercom services, a club house, gym, closed circuit security, powers backup generator, a beautiful garden, rain water harvesting and many other recreational facilities. The cost of the apartments is based on the request value.	Possession date: Dec'18	1435 sq ft(3BHK+3T)	3 BHK	900 - 1,435 sq ft	₹ 28.80 L - ₹ 45.92 L	2, 3 BHK	32	
23	Fateh Studio	Fateh Buildtech	Bommasandra	On Hold	Fateh Buildtech Studio Group is offering great apartments in the Jigani region of Bangalore. These apartments are still in an under construction form and the project is going to be launched soon, which has all the necessary provisions like bank, atm, hospital, bus station, restaurant, school, petrol pump etc nearby. The other facilities of the project are a beautiful playground for the children, an intercom service, 24 hours security back up facility, gym, swimming pool, club house, a beautiful garden, a community hall and facility of indoor games and ample space for parking a car for each owner of the apartments.	Possession date: Dec'18	1105 sq ft(2BHK+2T)	2 BHK	641 - 1,105 sq ft	₹ 17.95 L - ₹ 30.94 L	1, 2 BHK	189	
24	Mayur Brundavan	Mayur	Bommasandra	On Hold	Mayur Group has come up with a new residential project in the fast developing Electronic City of Bangalore, Mayur Brundavan that offers a range of planned and economically designed apartments. Brundavan has a total of 256 units on offer that are presently under construction. Buyers interested in the property can enquire for further details directly from the builder or avail of units via resale. The units on offer have 2 BHK apartments in 3 different sizes of 900, 915 and 935 sq. ft. Prices for these apartments have been estimated to be around 24.3 lakhs, 24.7 and 25.2 lakhs respectively. Resale prices for the same are around 25, 25.4 and 26 lakhs respectively. Residents at Mayur Brundavan will have access to a wide range of facilities including a gymnasium, jogging track, swimming pool, power backup, departmental stores within campus, visitor park, shuttle and badminton court, amphitheatre, party hall and children's play area.Mayur Group of developers are a diversified firm that has earned a reputation in the Bangalore real estate market for having successfully completed a total of 9 residential projects and having 7 ongoing projects.	Possession started from: Dec'17	950 sq ft(2BHK+2T)	2 BHK	900 - 950 sq ft	₹ 24.30 L - ₹ 25.65 L	2 BHK	256	
25	Gomati Iris	Gomati	Bommasandra	Under Construction	Gomati Iris by Gomati Infratech at Bommasandra Bangalore is one of the most sought after residential project in Electronic City Bangalore of the recent times. Current status of properties in Gomati Iris are Under Construction. Gomati Iris by Gomati Infratech is nominally priced and is very conveniently located. The surroundings provide access to facilities like hospitals, schools, banks, convenience store etc. Gomati Iris by Gomati Infratech offers a total of 186 well-planned and perfectly-designed units. It offers 2 BHK, 3 BHK residential properties. The project offers world class residential units with latest specifications that meet the expectations of the urban lifestyle. Gomati Iris by Gomati Infratech ensures comfortable lifestyle of unmatched quality through amenities like Multipurpose Room, Car Parking, Swimming Pool, 24 X 7 Security, Others, Lift Available that are best in class and features. The lavish yet thoughtfully designed residences potentially marks Gomati Iris as one of the most promising residential projects in Electronic City Bangalore. Project is conveniently priced across various budgets.	Possession date: Dec'18	1435 sq ft(3BHK+2T)	3 BHK	1,030 - 1,435 sq ft	₹ 32.45 L - ₹ 45.20 L	2, 3 BHK	188	RERA ID: PR/KN/170731/000624
26	GR Sunshine	GR Projects	Carmelaram	Under Construction	GR Projects Sunshine is located in Carmelaram, Bengalore. This magnificent projects comes with premium facilities like multi-layered with video door phone, departmental store, games Room, billiards, table tennis, Laundromat, party hall, badminton court, volley ball court, cricket practice pitch, CPVC fittings and piping for water supply, high quality HDPE pipes for sewer lines, service lift, fire fighting system and many others.Situated south of Bengalore, Carmelaram is a popular residential area with neighboring places like Varthur, Bellandur, Marathahalli, Avalahalli, Ramagondanahalli, Sarjapur Road Post Railway Crossing, Sarjapur Road. Â Confident, Kristal, DSR Infrastructures Pvt Ltd, Concorde Group, GR Projects, Corporate Leisure, Aratt, Aishwarya Associates and Janani Home are the key builders of the area.	Possession date: Dec'18	2950 sq ft(4BHK+4T)	4 BHK	833 - 2,950 sq ft	₹ 33.32 L - ₹ 1.24 Cr	1, 2, 3, 4 BHK	174	
27	DSR White Waters	DSR Infrastructures	Carmelaram	Under Construction		Possession date: Jun'19	1647 sq ft(3BHK+3T)	3 BHK	1,089 - 1,647 sq ft	₹ 48.46 L - ₹ 73.29 L	2, 3 BHK	195	RERA ID: PR/KN/170731/000841
28	Prestige Fairfield	Prestige Group	RMV	On Hold	RMV region of Bengaluru is a developing region for the prosperity of real estate business. Prestige Fairfield Apartment organization is offering great and spacious apartments. The project is all set for moving in purpose. The required necessities like park, petrol pump, school, restaurant, bus station, ATM, bank, hospital etc in the neighbourhood. This neighbourhood of Bengaluru is very much popular as many other real estate companies have settled their business in this region. The project offers other amenities like intercom, security for 24 hours and power back up. The price of the Apartment is based on the request value.	Possession date: Dec'20	3286 sq ft(4BHK+4T)	4 BHK	1,984 - 3,286 sq ft	Price on request	3, 4 BHK	165	
29	DNR Casablanca	DNR Group	Mahadevapura	Under Construction		Possession date: Sep'21	1842 sq ft(3BHK+3T)	3 BHK	1,255 - 1,842 sq ft	₹ 71.41 L - ₹ 1.05 Cr	2, 3 BHK	148	RERA ID: PR/KN/170902/001978
30	Prabhavathi Lotus Grand	Prabhavathi	Begur	On Hold	Prabhavathi Builders is one of the trusted name among the reputed real estate builders and is widely known for its continuous efforts in designing the homes that truly provide residents the best in terms of living. Prabhavathi Lotus Grand is the most confounding residential project that is entirely blessed with the comfort and exclusively designed in the most sophisticated living. Being the most spacious as well as elite constructions, each and every homes are completely designed with the intention to bring the nature cradle straight away to your home.	Possession date: Nov'18	1740 sq ft(3BHK+3T)	3 BHK	680 - 1,740 sq ft	₹ 34.16 L - ₹ 61.20 L	1, 2, 3 BHK	80	
31	Prabhavathi Springs Field	Prabhavathi	Begur	On Hold		Possession date: Dec'18	1472 sq ft(3BHK+3T)	3 BHK	816 - 1,472 sq ft	₹ 36.40 L - ₹ 55.94 L	1, 2, 3 BHK	215	
